id,qno,chapter,questionType,stem,optionA,optionB,optionC,optionD,optionE,correctAnswer,analysis,difficulty,source,isActive
q_00733,70,第三章 电力中长期市场,multiple,"根据《电力市场监管办法》,电力监管机构对售电企业、电力用户、储能企业、虚 拟电厂、负荷聚合商等参与批发电力市场交易行为中的( )实施监管",不正当竞争,串通报价,所属或者关联企业市场份额,其他违规交易行为 O,,ABD,暂无解析,未设置,电力交易题库_结构化初版.docx,true
q_00734,71,第三章 电力中长期市场,multiple,"根据《电力市场监管办法》,国家发展改革委、国家能源局依法组织制定电力市场 运行规则。电力市场运行规则包括( )、信用管理、信息披露等相关规则、细则",电力市场运行基本规则,市场准入注册,交易组织,计量结算,,ABCD,暂无解析,未设置,电力交易题库_结构化初版.docx,true
q_00735,72,第三章 电力中长期市场,multiple,"根据《电力市场监管办法》,出现以下情形中的( )时,应当修订电力市场运 行规则",法律或者国家政策发生重大调整的,电力市场运行环境发生重大变化的,"交易组织电力市场成员提出修订意见和建议,电力监管机构、地方政府有关部门认为确 有必要的",电力监管机构、地方政府有关部门认为必要的其他情形 O,,ABCD,暂无解析,未设置,电力交易题库_结构化初版.docx,true
q_00736,73,第三章 电力中长期市场,multiple,"根据《北京电力交易中心跨区跨省电力中长期交易实施细则(修订稿)》 (京电交市 〔2022〕 26号),市场运蕾机构主要包括( )",北京电力交易中心,各省(区、市)电力交易中心,国家电力调度控制中心,网调、各省(区、市)电力调度控制中心,,ABCD,暂无解析,未设置,电力交易题库_结构化初版.docx,true
q_00737,74,第三章 电力中长期市场,multiple,"根据《北京电力交易中心跨区跨省电力中长期交易实施细则(修订稿)》 (京电交市 〔2022〕 26号),跨区跨省电力中长期电力用户按照细则参与跨区跨省交易,签订和履行交 易合同,提供交易所必须的( )以及相关生产信息",电力电量需求,用电价格,典型负荷曲线,公司资产 第三童 电力中长期市场,,AC,暂无解析,未设置,电力交易题库_结构化初版.docx,true
q_00738,75,第三章 电力中长期市场,multiple,"根据《北京电力交易中心跨区跨省电力中长期交易实施细则(修订稿)》 (京电交市 〔2022〕 26号),拥有燃煤自备电厂的用户应当按规定承担( )",国家政府性基金及附加,政策性交叉补贴,输配电价,系统备用费 O,,ABD,暂无解析,未设置,电力交易题库_结构化初版.docx,true
q_00739,76,第三章 电力中长期市场,multiple,"跨区跨省交易前,集中竟价、滚动撮合规模上限由相关电网企业(含电力调度机 构)根据本省区( )在交易平台确定",最大外送能力,受入能力,剩余通道能力,电网约柬情况,,ABC,暂无解析,未设置,电力交易题库_结构化初版.docx,true
q_00740,77,第三章 电力中长期市场,multiple,"根据《北京电力交易中心跨区跨省电力中长期交易实施细则(修订稿)》 (京电交市 〔2022〕 26号),集中竟价出清算法分为( )",边际电价法,统一出清法,报价撮合法,分散出清法,,AC,暂无解析,未设置,电力交易题库_结构化初版.docx,true
q_00741,78,第三章 电力中长期市场,single,"委托电网企业代理参与跨区跨省交易的电力用户或售电公司,必须有( )",履约保函,购售电合同,委托协议,书面协议,,C,暂无解析,未设置,电力交易题库_结构化初版.docx,true
q_00742,79,第三章 电力中长期市场,multiple,"经营主体参与跨区跨省集中竞价交易时,应( )申报电量、价格",分时段,分时,分阶梯,分段,,AC,暂无解析,未设置,电力交易题库_结构化初版.docx,true
q_00743,80,第三章 电力中长期市场,single,跨区跨省交易中的年度交易是指执行时间为( )的交易,自次年起多年,次年全部月份,次年部分月份,以上都是,,D,暂无解析,未设置,电力交易题库_结构化初版.docx,true
q_00744,81,第三章 电力中长期市场,single,"在跨区跨省交易中,采用滚动撮合方式组织交易时,若预成交电量小于预出清电 量,预成交曲线按照( )等比例调减",交易优先级,预出清曲线形状,清洁能源优先,时间优先,,B,暂无解析,未设置,电力交易题库_结构化初版.docx,true
q_00745,82,第三章 电力中长期市场,single,"根据《北京电力交易中心跨区跨省电力中长期交易实施细则(修订稿)》 (京电交市 〔2022〕 26号),采用集中竞价交易方式时,对购电方和售电方报价可实行最高限价和最低 限价。最低限价和最高限价由( )提出,经国家能源局派出机构和地方政府相关部门 审定后发布",电力调度机构,交易中心,市场管理委员会,国调中心 -、不定项选择题,,C,暂无解析,未设置,电力交易题库_结构化初版.docx,true
q_00746,83,第三章 电力中长期市场,single,"跨区跨省电力中长期交易中,电网企业依据跨区跨省( ),作为购电方'签订 和履行厂网间优先发电合同及跨区跨省交易合同",优先发电计划,交易计划,剩余通道输电能力,计划分配电量,,A,暂无解析,未设置,电力交易题库_结构化初版.docx,true
q_00747,84,第三章 电力中长期市场,multiple,跨区跨省交易中双边协商交易流程包括( )、安全校核、成交结果发布,要约填报,要约受理,要约发布,交易申报,交易预成交及发布 O,ABCDE,暂无解析,未设置,电力交易题库_结构化初版.docx,true
q_00748,85,第三章 电力中长期市场,single,"根据《电力中长期交易基本规则》 (发改能源规〔2020) 889号),计量数据出现错 误时,应由( )出具书面报告,购售双方协商一致并提供书面确认材料,对结算数据 进行修正",电力交易机构,相关计量权威部门,电网企业,政府主管部门,,B,暂无解析,未设置,电力交易题库_结构化初版.docx,true
q_00749,86,第三章 电力中长期市场,multiple,"执行日后( )个工作日内,北京电力交易中心将跨区跨省电力中长期交易日清 分结果通过交易平台向相关市场主体和省(区、市)电力交易中心发布゜相关方在收到交 易清分单后( )个工作日通过平台确认,逾期视为已确认",5,4,2,1,,AC,暂无解析,未设置,电力交易题库_结构化初版.docx,true
q_00750,87,第三章 电力中长期市场,single,"每月前( )个工作日内,北京电力交易中心依据跨区跨省交易核对结算单及协 商结果形成正式结算单,签章后通过交易平台向相关市场主体和省(区、市)电力交易中 心发布,市场主体(含电网企业)之间依据交易结算单、国家相关文件和合同约定开展电 费结算",5,7,9,10,,C,暂无解析,未设置,电力交易题库_结构化初版.docx,true
q_00751,88,第三章 电力中长期市场,single,绿色电力交易按照相关中长期交易规则( )结算,同等,优先,滞后,全额,,B,暂无解析,未设置,电力交易题库_结构化初版.docx,true
q_00752,89,第三章 电力中长期市场,multiple,电力交易机构向经营主体出具的绿色电力交易结算依据包含( ),绿色电力交易电能量结算电量、电能量价格、电能量费用,绿色电力交易绿色电力环境价值结算电量、绿色电力环境价值、绿色电力环境价值费用,绿色电力交易电能量偏差结算费用,绿色电力环境价值偏差补偿费用 O,,ABCD,暂无解析,未设置,电力交易题库_结构化初版.docx,true
q_00753,90,第三章 电力中长期市场,multiple,绿电电力交易方式包括( ),双边协商,挂牌交易,集中竟价,滚动撮合,,ABC,暂无解析,未设置,电力交易题库_结构化初版.docx,true
q_00754,91,第三章 电力中长期市场,single,"绿色电力证书是国家对发电企业每( )可再生能源上网电量颁发的具有唯一代 码标识的电子凭证,作为绿色电力环境价值的唯一凭证",千瓦时,兆瓦时,千千瓦时,万千瓦时,,B,暂无解析,未设置,电力交易题库_结构化初版.docx,true
q_00755,92,第三章 电力中长期市场,multiple,以下属于参与绿色电力交易的经蕾主体的是( ),发电企业(含分布式发电主体),电力用户,售电公司,聚合商,储能和虚拟电厂,ABCDE,暂无解析,未设置,电力交易题库_结构化初版.docx,true
q_00756,93,第三章 电力中长期市场,single,"分布式发电主体准入参与绿电市场后,以( )方式参与绿色电力交易",挂牌,聚合,售电公司竞价,聚合商双边协商,,B,暂无解析,未设置,电力交易题库_结构化初版.docx,true
q_00757,94,第三章 电力中长期市场,multiple,"绿电交易组织中, ( )属于各省级电力交易中心的权利与义务",电力交易市场注册,出具绿电交易相关结算依据 c信息披露,,配合政府主管部门完善省内相关交易规则,,ABCD,暂无解析,未设置,电力交易题库_结构化初版.docx,true
q_00758,95,第三章 电力中长期市场,multiple,"绿电交易组织中, ( )属于电力调度机构的权利与义务",参与编制、修订绿色电力交易相关规则,安全校核,通道可用输电容量,保障绿色电力交易结果的执行,,BCD,暂无解析,未设置,电力交易题库_结构化初版.docx,true
q_00759,96,第三章 电力中长期市场,multiple,"绿色电力交易平台是支撑绿色电力交易开展的技术支持系统, ( )属于绿色电 力交易平台","″e一交易""平台",″e一交易″App,新一代电力交易平台,电力交易App,,BC,暂无解析,未设置,电力交易题库_结构化初版.docx,true
q_00760,97,第三章 电力中长期市场,multiple,经营主体的绿色电力账户包括参与绿色电力交易的( )等信息,合同,结算,绿证核发,绿证划转 lO,,ABCD,暂无解析,未设置,电力交易题库_结构化初版.docx,true
q_00761,98,第三章 电力中长期市场,multiple,"参与绿色电力交易的电力用户,其用电价格由( )、输配电价、政府性基金及 附加等构成",电能量价格,绿证价格,上网环节线损费用,系统运行费用,,ABCD,暂无解析,未设置,电力交易题库_结构化初版.docx,true
q_00762,99,第三章 电力中长期市场,single,"采用集中方式组织年度绿电交易时,绿色电力环境价值统一取交易组织当年 )绿证市场成交均价 (",1-9月,1-10月,1-11月,前三季度,,B,暂无解析,未设置,电力交易题库_结构化初版.docx,true
q_00763,100,第三章 电力中长期市场,multiple,"关于平价项目参与绿电交易,以下说法正确的是( )",所有平价项目均可参与绿电交易,交易电价可能高于当地燃煤基准价,成交电量对应绿证可进行转让,属于电力中长期交易,,BD,暂无解析,未设置,电力交易题库_结构化初版.docx,true
q_00764,101,第三章 电力中长期市场,single,"在绿电交易结算过程中,对计量数据存在疑义时,由具有相应资质的电能计量检 测机构确认并出具报告,由电网企业组织( )协商解决",相关市场成员,相关市场运营机构,相关市场经营主体,相关发电企业,,A,暂无解析,未设置,电力交易题库_结构化初版.docx,true
q_00765,102,第三章 电力中长期市场,multiple,北京电力交易中心负责绿证交易的具体工作包括( ),交易组织,交易结算,信息披露,市场主体注册,,ABC,暂无解析,未设置,电力交易题库_结构化初版.docx,true
q_00766,103,第三章 电力中长期市场,multiple,"在绿证信息中,标记( )等信息,用以满足不同用户购买需求",发电类型,上网电量,补贴情况,发电生产日期,,ABD,暂无解析,未设置,电力交易题库_结构化初版.docx,true
q_00767,104,第三章 电力中长期市场,single,"在用户完成绿证交易全部资金支付后( )内,相应资金划入发电企业资金 账户",1个工作日,2个工作日,3个工作日,5个工作日,,A,暂无解析,未设置,电力交易题库_结构化初版.docx,true
q_00768,105,第三章 电力中长期市场,multiple,绿证交易信息披露的主要内容包括成交( )等信息,日期,规模 c.均价,,绿证类型 0,,BCD,暂无解析,未设置,电力交易题库_结构化初版.docx,true
q_00769,106,第三章 电力中长期市场,single,"根据《北京电力交易中心可再生能源电力超额消纳量交易规则(试行)》, ( 依规履行全国超额消纳量交易市场监督职责。",国家发展改革委,各省级能源主管部门,国家能源局派出监管机构,国家能源局,,D,暂无解析,未设置,电力交易题库_结构化初版.docx,true
q_00770,107,第三章 电力中长期市场,single,"根据《北京电力交易中心可再生能源电力超额消纳量交易规则(试行)》,超额消 纳量交易通过( )开展交易",新一代电力交易平台,"""e一交易"" App",可再生能源电力消纳凭证交易系统,可再生能源消纳凭证交易系统,,C,暂无解析,未设置,电力交易题库_结构化初版.docx,true
q_00771,1,第三章 电力中长期市场,blank,电力市场成员包括( )、( )和( )。,,,,,,经营主体 电力市场运营机构 提供输配电服务的电网企业,暂无解析,未设置,电力交易题库_结构化初版.docx,true
q_00772,2,第三章 电力中长期市场,blank,"电力用户有权获得公平的输配电服务和电网接入服务,按时支付( )、 ( )、 政府性基金及附加等。",,,,,,购电费 输配电费,暂无解析,未设置,电力交易题库_结构化初版.docx,true
q_00773,3,第三章 电力中长期市场,blank,"并网自备电厂公平承担发电企业社会责任、承担国家依法依规设立的政府性基金及 附加以及与产业政策相符合的政策性交叉补贴,取得电力业务许可证(发电类),达到 ( )、 ( )要求,可作为市场主体参与市场化交易。",,,,,,能效 环保,暂无解析,未设置,电力交易题库_结构化初版.docx,true
q_00774,4,第三章 电力中长期市场,blank,电能量市场化交易(含省内和跨区跨省)价格包括( )、( )、( )和超 低排放电价。,,,,,,脱硫 脱硝 除尘,暂无解析,未设置,电力交易题库_结构化初版.docx,true
q_00775,5,第三章 电力中长期市场,blank,集中竟价交易可采用( )或者( )等价格形成机制。,,,,,,边际出清 高低匹配,暂无解析,未设置,电力交易题库_结构化初版.docx,true
q_00776,6,第三章 电力中长期市场,blank,"滚动撮合交易是指在规定的交易起止时间内,市场主体可以随时提交购电或者售电 信息,电力交易平台按照( )、 ( )的原则进行滚动撮合成交,采用( )、 )的价格形成机制。 ( 07各电力交易机构负责组织开展可再生能源电力相关交易,在中长期电力交易 ( )、 ( )等环节对承担消纳责任的市场主体给予提醒。",,,,,,合同审核 电力交易信息公布,暂无解析,未设置,电力交易题库_结构化初版.docx,true
q_00777,8,第三章 电力中长期市场,blank,月内交易主要以( )方式开展。,,,,,,集中交易,暂无解析,未设置,电力交易题库_结构化初版.docx,true
q_00778,9,第三章 电力中长期市场,blank,"月内交易结柬后,电力调度机构在( )个工作日内返回安全校核结果,由电力 交易机构发布。",,,,,,1,暂无解析,未设置,电力交易题库_结构化初版.docx,true
q_00779,10,第三章 电力中长期市场,blank,"采用( )和( )相结合的方式,推动优先发电参与市场゜ Ⅱ.为有效规避市场风险,对现货市场以及集中撮合的中长期交易实施( )和 )限价。 (",,,,,,最高 最低,暂无解析,未设置,电力交易题库_结构化初版.docx,true
q_00780,12,第三章 电力中长期市场,blank,"根据《电力中长期交易基本规则》 (发改能源规(2020〕 889号),系统月度实际用 电需求与月度发电计划存在偏差时,可通过发电侧( )机制进行处理,采用 )""方式,具有调节能力的机组均应当参与上下调报价。 ""(",,,,,,上下调预挂牌 报价不报量,暂无解析,未设置,电力交易题库_结构化初版.docx,true
q_00781,13,第三章 电力中长期市场,blank,"组织年度交易应当在年度电力电量预测平衡的基础上,结合检修计划,按照不低于 关键通道可用输电容量的( ) %下达交易限额。",,,,,,80,暂无解析,未设置,电力交易题库_结构化初版.docx,true
q_00782,14,第三章 电力中长期市场,blank,"电力调度机构应当根据经安全校核后的月度(含调整后的)发电计划以及清洁能源 消纳需求,合理安排电网( )和( )。",,,,,,运行方式 机组开机方式,暂无解析,未设置,电力交易题库_结构化初版.docx,true
q_00783,15,第三章 电力中长期市场,blank,"无正当理由退市的电力用户,由( )承担保底供电责任゜电网企业与电力用户 交易的保底价格在电力用户缴纳输配电价的基础上,按照政府核定的目录电价的( ) 倍执行。",,,,,,为其提供输配电服务的电网企业1.2-2,暂无解析,未设置,电力交易题库_结构化初版.docx,true
q_00784,16,第三章 电力中长期市场,blank,"对于滥用市场操纵力、不良交易行为等违反电力市场秩序的行为,可进行市场内部 曝光,对于严重违反交易规则的行为,可依据( )等有关规定处理",,,,,,《电力监管条例》,暂无解析,未设置,电力交易题库_结构化初版.docx,true
q_00785,17,第三章 电力中长期市场,blank,"售电公司在批发市场与零售市场应考虑( )和( )等费用,相关盈亏由售 电公司承担。",,,,,,电力辅助服务费用 阻塞费用,暂无解析,未设置,电力交易题库_结构化初版.docx,true
q_00786,18,第三章 电力中长期市场,blank,"现阶段,需研究完善零售市场与批发市场在( )、( )、( )等方面的衔 接机制,推动零售市场更加有效地融入电力市场体系。",,,,,,交易周期 价格传导 偏差处理,暂无解析,未设置,电力交易题库_结构化初版.docx,true
q_00787,19,第三章 电力中长期市场,blank,"电网企业应当根据市场运行需要为经营主体安装符合技术规范的计量装置,计量装 置原则上安装在( ),该处无法安装计量装置的,考虑相应的变(线)损。",,,,,,产权分界点,暂无解析,未设置,电力交易题库_结构化初版.docx,true
q_00788,20,第三章 电力中长期市场,blank,发电企业、跨区跨省交易送受端计量点应当安装相同( )、相同( )、相同 )的主、副电能表各一套。 (,,,,,,型号 规格 精度,暂无解析,未设置,电力交易题库_结构化初版.docx,true
q_00789,21,第三章 电力中长期市场,blank,"发电企业偏差电量指发电企业因( )引起的超发或者少发电量,超发电量获得 售电费用,少发电量支付购电费用。",,,,,,自身原因,暂无解析,未设置,电力交易题库_结构化初版.docx,true
q_00790,22,第三章 电力中长期市场,blank,"电力调度机构应当对结算周期内发电企业的偏差电量进行记录,包括偏差原因、起 止时间、偏差电量等。在发电企业( )电量基础上,扣除各类合同电量、偏差电量 后,视为发电企业的( )电量,按照其申报价格结算。",,,,,,实际上网 上下调,暂无解析,未设置,电力交易题库_结构化初版.docx,true
q_00791,23,第三章 电力中长期市场,blank,"根据《电力中长期交易基本规则》 (发改能源规〔2020〕 889号),除( )执行 政府确定的价格外,电力中长期交易的成交价格应通过市场化方式形成。",,,,,,计划电量,暂无解析,未设置,电力交易题库_结构化初版.docx,true
q_00792,24,第三章 电力中长期市场,blank,"根据《电力中长期交易基本规则》 (发改能源规〔2020〕 889号),优先发电电量和 基数电量的分月计划可由合同签订主体在( )进行调整和确认,其执行偏差可通过预 挂牌上下调机制(或其他偏差处理机制)处理。",,,,,,月度执行前,暂无解析,未设置,电力交易题库_结构化初版.docx,true
q_00793,25,第三章 电力中长期市场,blank,月度电量交易计划主要包括( )、预安排的多发(少发)电量、 ( )、 ( )、 ( )、跨区跨省购电量、地调宜调发电企业计划电量、非统调发电企业上网电 量等。 企业市场合同电量 优先发电计划电量,,,,,,次月全网调度发受电量预测 煤电(含煤秆石发电)企业市场合同电量 其他发电,暂无解析,未设置,电力交易题库_结构化初版.docx,true
q_00794,26,第三章 电力中长期市场,blank,"根据《电力中长期交易基本规则》 (发改能源规〔2020〕 889号),双边交易价格按 照( )执行。",,,,,,双方合同约定,暂无解析,未设置,电力交易题库_结构化初版.docx,true
q_00795,27,第三章 电力中长期市场,blank,跨区跨省交易晶种分为( )、( )、( )、( )等。 二、摸空题,,,,,,电能量交易 绿电交易 合同变更 合同转让,暂无解析,未设置,电力交易题库_结构化初版.docx,true
q_00796,28,第三章 电力中长期市场,blank,"根据《北京电力交易中心跨区跨省电力中长期交易实施细则(修订稿)》 (京电交市〔2022〕 26号),市场主体无法履约的,应至少提前( )天以书面形式告 知电网企业、售电公司、发电企业、电力交易机构等相关方,将所有已签订的购售电合同 履行完毕或转让,并处理好相关事宜。",,,,,,45,暂无解析,未设置,电力交易题库_结构化初版.docx,true
q_00797,29,第三章 电力中长期市场,blank,"根据《北京电力交易中心跨区跨省电力中长期交易实施细则(修订稿)》 (京电交市〔2022〕 26号),参加市场化交易的电力用户全部电量(包含省内和跨区跨 省)需通过批发或者零售交易购买,且不得同时参加批发交易和零售交易。所有参加市场 化交易的电力用户均不再执行( )。",,,,,,日录电价,暂无解析,未设置,电力交易题库_结构化初版.docx,true
q_00798,30,第三章 电力中长期市场,blank,"根据《北京电力交易中心跨区跨省电力中长期交易实施细则(修订稿)》 (京电交市 〔2022) 26号),跨区跨省电能量交易的标的物为( )。",,,,,,分时段电能量,暂无解析,未设置,电力交易题库_结构化初版.docx,true
q_00799,31,第三章 电力中长期市场,blank,跨区跨省交易中送受端省份结算关口计量点原则上设在该省( );跨区跨省通 道的结算关口计量点原则上设在跨区跨省输电通道的( )和( )。,,,,,,产权分界点 上网关口 下网关口,暂无解析,未设置,电力交易题库_结构化初版.docx,true
q_00800,32,第三章 电力中长期市场,blank,"集中竟价采用边际出清法时,当购方申报曲线与售方申报曲线交叉,交叉点对应的 价格即为边际出清价格。计算后的售方报价( )边际出清价格的售方申报电量、计算 后的购方报价( )边际出清价格的购方申报电量成交;若边际出清价格对应的购方申 报电量与售方申报电量不等,预出清电量取( )。",,,,,,低于 高于 二者较小值,暂无解析,未设置,电力交易题库_结构化初版.docx,true
q_00801,33,第三章 电力中长期市场,blank,"根据《北京电力交易中心绿色电力交易实施细则(修订稿)》 (京电交市〔2023〕 44 号),常态化开展中长期分时段交易的地区应按照相关规则,开展( )或( )的绿 色电力交易。",,,,,,分时段 带电力曲线,暂无解析,未设置,电力交易题库_结构化初版.docx,true
q_00802,34,第三章 电力中长期市场,blank,跨区跨省交易购方落地价格由( )、各环节( )、( )等构成,,,,,,交易上网价格 输电价格 输电损耗,暂无解析,未设置,电力交易题库_结构化初版.docx,true
q_00803,35,第三章 电力中长期市场,blank,"跨区跨省交易中,若输电损耗在( )中已明确包含的,不再单独收取;未明确 的,暂按该输电通道前三年( )计算,报国家能源局备案后执行゜输电损耗原则上由 ( )承担,也可由市场主体协商确定承担方式。",,,,,,输电价格 输电损耗的平均值 买方,暂无解析,未设置,电力交易题库_结构化初版.docx,true
q_00804,36,第三章 电力中长期市场,blank,超额消纳量交易标的物是由每( )超额消纳量生成1个超额消纳凭证。,,,,,,1Mwh,暂无解析,未设置,电力交易题库_结构化初版.docx,true
q_00805,37,第三章 电力中长期市场,blank,绿色电力产品是指符合国家有关政策要求的风电、光伏等可再生能源发电企业 ( )。,,,,,,上网电量,暂无解析,未设置,电力交易题库_结构化初版.docx,true
q_00806,38,第三章 电力中长期市场,blank,参与绿色电力交易的市场成员包括( )、( )和( )。,,,,,,经营主体 电网企业 市场运蕾机构,暂无解析,未设置,电力交易题库_结构化初版.docx,true
q_00807,39,第三章 电力中长期市场,blank,"( )按照相关规定为可再生能源发电企业核发绿证,并将绿证划转至北京电力 交易中心,计入绿色电力交易平台发电企业的( )。",,,,,,国家可再生能源信息管理中心 绿色电力账户,暂无解析,未设置,电力交易题库_结构化初版.docx,true
