id,qno,chapter,questionType,stem,optionA,optionB,optionC,optionD,optionE,correctAnswer,analysis,difficulty,source,isActive
q_00001,1,第一章 电力市场基础,single,"商品的价格越高需求量越低,价格越低需求量越高,这种相互依存的负相关关系, 被称为( )",价格规律,供给规律,需求规律,价值规律,,C,暂无解析,未设置,电力交易题库_结构化初版.docx,true
q_00002,2,第一章 电力市场基础,single,"商晶的需求量越高价格越高,需求量越低价格越低,这种相互依存的正比关系'被 称为( )",供给规律,价格规律,价值规律,需求规律,,A,暂无解析,未设置,电力交易题库_结构化初版.docx,true
q_00003,3,第一章 电力市场基础,single,( )水平是由电能价值决定的基础价格和由供求关系规律决定的供求价格组成,利润,电价,成本,管理,,B,暂无解析,未设置,电力交易题库_结构化初版.docx,true
q_00004,4,第一章 电力市场基础,single,电力市场的载体是( ),配电商,输配电网,电力库,通信设备,,B,暂无解析,未设置,电力交易题库_结构化初版.docx,true
q_00005,5,第一章 电力市场基础,multiple,"电力市场与普通商品市场相比具有显著的特殊性,归根到底就在于电力商品与其他 一般商品的差异性。电能与其他商品最本质差异在于其( )",成本属性,自然属性,社会属性,传输属性,,BC,暂无解析,未设置,电力交易题库_结构化初版.docx,true
q_00006,6,第一章 电力市场基础,single,市场实现对资源优化配置的重要杠杆是( ),价格机制,供求机制,竟争机制,市场机制,,A,暂无解析,未设置,电力交易题库_结构化初版.docx,true
q_00007,7,第一章 电力市场基础,single,英国电力市场电价构成包括( ),平衡市场确定的电量电价和不平衡电价,双边合同确定的电量电价和不平衡电价,双边合同确定的电量电价和平衡市场确定的电量电价,双边合同确定的电量电价、平衡市场确定的电量电价和不平衡电价,,D,暂无解析,未设置,电力交易题库_结构化初版.docx,true
q_00008,8,第一章 电力市场基础,multiple,欧盟内部能源电力市场包括( ),日前(DA)市场,日内(ID)市场,平衡市场,远期市场 ゜,,ABCD,暂无解析,未设置,电力交易题库_结构化初版.docx,true
q_00009,9,第一章 电力市场基础,single,美国PJM采用的节点边际电价包括( ),系统电能价格和输电阻塞价格,输电阻塞价格和网损价格,系统电能价格和网损价格,系统电能价格、输电阻塞价格和网损价格,,D,暂无解析,未设置,电力交易题库_结构化初版.docx,true
q_00010,10,第一章 电力市场基础,single,美国ERCOT市场三部制报价包括( ),Pm电力市场,澳大利亚电力市场,英国电力市场,北欧电力市场 O,,D,暂无解析,未设置,电力交易题库_结构化初版.docx,true
q_00011,12,第一章 电力市场基础,single,美国得克萨斯电力市场中辅助服务出清的性质是( ),实物+金融性质,实物性质,金融性质,以上均不正确,,B,暂无解析,未设置,电力交易题库_结构化初版.docx,true
q_00012,13,第一章 电力市场基础,single,"由于政府的特许经营,可能形成的一种市场类型是( )",完全垄断市场,完全竟争市场,垄断竟争市场,寡头垄断市场 O,,A,暂无解析,未设置,电力交易题库_结构化初版.docx,true
q_00013,14,第一章 电力市场基础,single,下列选项中不属于电力金融交易的是( ),期权交易,辅助服务交易,期货交易,差价合同交易,,B,暂无解析,未设置,电力交易题库_结构化初版.docx,true
q_00014,15,第一章 电力市场基础,multiple,电力资源配置的三种作用力是( ),市场价格,企业管理,政府指令,发电资源,,ABC,暂无解析,未设置,电力交易题库_结构化初版.docx,true
q_00015,16,第一章 电力市场基础,multiple,北欧电力交易所股东包括( )。 -、不定项选择题,德国电网公司,英国电网公司,北欧和波罗的海电网公司,泛欧洲证券交易所,,CD,暂无解析,未设置,电力交易题库_结构化初版.docx,true
q_00016,17,第一章 电力市场基础,multiple,欧洲批发能源市场的完整性和透明度法规REMIT的目标是( ),市场整合的信心,公平体现供求竞争性交互的市场价格,确保没有人从市场中不正当获利,建立统一欧洲电力市场,,ABC,暂无解析,未设置,电力交易题库_结构化初版.docx,true
q_00017,18,第一章 电力市场基础,single,( )是欧盟电网管理代码的欧盟市场稠合的设置标准,《电网容量分配和阻塞管理导则》 (CACM法规),北欧电力交易所(NrdPl)标准,欧洲批发能源市场的完整性和透明度法规REMIT,国家监管机构(NGA)法规,,A,暂无解析,未设置,电力交易题库_结构化初版.docx,true
q_00018,19,第一章 电力市场基础,multiple,北欧电力市场的主要市场特征包括( ),市场流动性,"组合招标,自行调度",市场区域间可用传输容量的隐性拈卖,价格透明度,,ABCD,暂无解析,未设置,电力交易题库_结构化初版.docx,true
q_00019,20,第一章 电力市场基础,single,社会福利为生产者剩余和消费者剩余之( ),和,差 c.积,,商,,A,暂无解析,未设置,电力交易题库_结构化初版.docx,true
q_00020,21,第一章 电力市场基础,multiple,影响价格弹性的因素包括( ),商品的可替代性,商品用途的广泛性,对消费者的重要程度,商品的消费支出在消费者预算总支出中所占的比重,,ABCD,暂无解析,未设置,电力交易题库_结构化初版.docx,true
q_00021,22,第一章 电力市场基础,single,"需求弹性为( ),说明市场富于弹性",大于等于1,大于1 c.等于1,,小于1,,B,暂无解析,未设置,电力交易题库_结构化初版.docx,true
q_00022,23,第一章 电力市场基础,single,"垄断市场的三级价格歧视中,一级价格歧视是指( )",垄断厂商对同一种产晶在不同的市场上/消费群体收取不同的价格,垄断厂商对同一种产品在不同的市场上/消费群体收取相同的价格,垄断厂商要求对不同的消费数量段规定不同的价格,垄断厂商对每一单位产品都按消费者所愿意支付的最高价格出售,,D,暂无解析,未设置,电力交易题库_结构化初版.docx,true
q_00023,24,第一章 电力市场基础,single,不同市场的经济效益由高到低排序为( ),完全竟争>寡头>垄断竟争>垄断,完全竞争>垄断>垄断竟争>寡头,完全竟争>垄断竞争>寡头>垄断,寡头>垄断竟争>垄断>完全竞争,,C,暂无解析,未设置,电力交易题库_结构化初版.docx,true
q_00024,25,第一章 电力市场基础,single,"与完全竟争市场相比,垄断市场通常将引起( )",高价格和高产量,高价格和低产量,低价格和低产量,低价格和高产量 0,,B,暂无解析,未设置,电力交易题库_结构化初版.docx,true
q_00025,26,第一章 电力市场基础,multiple,形成完全垄断的原因是( ),政府的特许经营,专利权独家垄断,固定资产投资规模过大,对行业重要资源的垄断占有,限制新企业进入该行业市场,ABCDE,暂无解析,未设置,电力交易题库_结构化初版.docx,true
q_00026,27,第一章 电力市场基础,single,下列不属于垄断竟争市场特征的是( ),"企业生产有差别的同种产品,产品彼此之间都是非常接近的替代品",生产同种产品的企业数量非常多,"企业的生产规模较小,进入和退出市场比较容易",市场内从事交易活动的参与者可以完整地掌握市场信息,,D,暂无解析,未设置,电力交易题库_结构化初版.docx,true
q_00027,28,第一章 电力市场基础,single,( )电价是指电力生产企业向电网经营企业输送电能的结算价格,输配,上网,销售,峰谷,,B,暂无解析,未设置,电力交易题库_结构化初版.docx,true
q_00028,29,第一章 电力市场基础,single,( )是根据生产单位产晶的产量或产值所需耗用的电量、预测期生产的产品产 量或产值来测算预测期用电量的方法,电力弹性系数法,回归分析法,单耗法,时间序列法,,C,暂无解析,未设置,电力交易题库_结构化初版.docx,true
q_00029,30,第一章 电力市场基础,multiple,下列可以作为大宗商品进行交易的有( ),金属,稻谷、小麦,天然气、石油,电力,,ABCD,暂无解析,未设置,电力交易题库_结构化初版.docx,true
q_00030,31,第一章 电力市场基础,multiple,以下属于电力金融市场的是( ),电力期货,电力期权,金融输电权,现货交易,,ABC,暂无解析,未设置,电力交易题库_结构化初版.docx,true
q_00031,32,第一章 电力市场基础,single,"根据预测发电报价曲线和系统负荷的预测值求解市场均衡点,进而导出电价的预测 值。这种预测电价的方法是( )",市场均衡分析法,神经网络法,模糊建模法,运行仿真法,,A,暂无解析,未设置,电力交易题库_结构化初版.docx,true
q_00032,33,第一章 电力市场基础,single,边际成本是指( ),企业多生产一单位产量引起的总成本的变动,企业增加单位产晶销售所获得的总收入增量,企业在短期内平均每生产一单位产晶所消耗的全部成本,企业在短期内平均每生产一单位产晶所消耗的可变成本,,A,暂无解析,未设置,电力交易题库_结构化初版.docx,true
q_00033,34,第一章 电力市场基础,single,"上升的电价会激励发电公司投资建设新电厂,发电容量将增加,直至( )的最 佳点为止",电价等于发电短期边际成本,电价略高于发电短期边际成本,电价等于发电长期边际成本,电价略高于发电长期边际成本,,C,暂无解析,未设置,电力交易题库_结构化初版.docx,true
q_00034,35,第一章 电力市场基础,multiple,下列关于完全竟争市场的叙述中正确的是( ),任何一个市场成员所占的市场份额都微不足道,不同企业的同类产品之间在性能、价格等方面有差异,"无论企业向市场提供多少数量的商品,平均年收益和边际收益都不随着数量变动而变动","企业不会在平均成本的最低点上进行生产,市场价格往往高于边际成本,资源得不到最 好的利用",生产者与消费者对市场信息都能充分了解,ACE,暂无解析,未设置,电力交易题库_结构化初版.docx,true
q_00035,36,第一章 电力市场基础,multiple,下面选项中影响电力需求的主要因素包括( ),电价,电力投资 c.供电电压等级,,替代能源 E.需求侧管理,,ABDE,暂无解析,未设置,电力交易题库_结构化初版.docx,true
q_00036,37,第一章 电力市场基础,multiple,"用短期边际成本法进行输电定价,输电成本包括( )",网损,电网固定资产折旧 c.系统约柬成本,,维护成本 E.系统扩展成本 ③,,ACD,暂无解析,未设置,电力交易题库_结构化初版.docx,true
q_00037,38,第一章 电力市场基础,multiple,金融输电权一般包括的要素是( ),注入节点,流出节点,功率,时间段 0,,ABCD,暂无解析,未设置,电力交易题库_结构化初版.docx,true
q_00038,39,第一章 电力市场基础,single,( )是指一个人的行为或企业的行为使其他人或企业的经济利益受损,负外部性,正外部性,负相关,正相关,,A,暂无解析,未设置,电力交易题库_结构化初版.docx,true
q_00039,40,第一章 电力市场基础,single,"英国中长期市场交易电量占总电量的( )以上,日前市场、日内市场和平衡机 制交易电量大约占总电量的( )","75%, 10%",85%' 10%,75%' 15%,"85%, 15% ⑩",,D,暂无解析,未设置,电力交易题库_结构化初版.docx,true
q_00040,41,第一章 电力市场基础,multiple,"假设某商品市场需求函数为庐30-2P,供给函数为茫3尸十10,均衡价格和均衡产量 各为( )",尸=4,尸=6,g=20,g=22,,AD,暂无解析,未设置,电力交易题库_结构化初版.docx,true
q_00041,42,第一章 电力市场基础,multiple,"假如消费函数c=10m渺(其中c为均衡消费,少为均衡收入),投资;=50,则 ( )",均衡收入为750,均衡收入为700,均衡消费为700,均衡储蓄为50 0,,ACD,暂无解析,未设置,电力交易题库_结构化初版.docx,true
q_00042,43,第一章 电力市场基础,single,北欧电力市场简写为( ),PJM,1SO-NE,CAISO,Nrd Pl,,D,暂无解析,未设置,电力交易题库_结构化初版.docx,true
q_00043,44,第一章 电力市场基础,single,"在英国的BETm模式中,再调度是通过( )来实现",日内市场中的二次报价,日前市场中的安全校核,现货市场中的平衡机制,通道容量的隐式拍卖,,C,暂无解析,未设置,电力交易题库_结构化初版.docx,true
q_00044,45,第一章 电力市场基础,single,下列电力市场中有金融输电权(FTR)的是( ),英国电力库模式,美国PJM电力市场,新加坡电力市场,中国电力市场 O,,B,暂无解析,未设置,电力交易题库_结构化初版.docx,true
q_00045,46,第一章 电力市场基础,single,"在给定的极短时段内向用户提供电能的边际成本,该电价不仅随时间变化,而且区 分节点位置、事故和可靠性电价。这种电价是( )",边际电价,上网电价,调节电价,实时电价 -、不定项选择题,,D,暂无解析,未设置,电力交易题库_结构化初版.docx,true
q_00046,47,第一章 电力市场基础,multiple,"在电力市场上,发电企业常用的竞争战略是( )",成本领先战略,重点集中式战略,差别化战略,补缺者战略,,ABCD,暂无解析,未设置,电力交易题库_结构化初版.docx,true
q_00047,48,第一章 电力市场基础,single,"按照HHI指数的定义,当1000≦HHI<1800,市场属于( )",低寡占市场,中寡占市场,高寡占市场,竞争型市场 O,,A,暂无解析,未设置,电力交易题库_结构化初版.docx,true
q_00048,49,第一章 电力市场基础,single,"在美国PJM市场中,某发电商在日前市场中标电量为20MWh,所在节点日前出清 价格为30美元ANWh,实时市场中发电量为30MWh,实时出清价格为40美元/MWh,则该 发电商的市场收益为( )美元",600,900,1000,1200 O,,C,暂无解析,未设置,电力交易题库_结构化初版.docx,true
q_00049,50,第一章 电力市场基础,single,"已知产量为500时,平均成本为2元,当产量增加到550时,平均成本等于2.5元゜ 在这一产量变化范围内,边际成本( )","随着产量的增加而增加,并小于平均成本","随着产量的增加而减少,并大于平均成本","随着产量的增加而减少,并小于平均成本","随着产量的增加而增加,并大于平均成本 ③",,D,暂无解析,未设置,电力交易题库_结构化初版.docx,true
q_00050,51,第一章 电力市场基础,single,"某厂商生产5件衣服的总成本为1500元,其中厂房和机器折旧为500元,工人工资 及原材料费用为1000元,那么平均可变成本为( )元。",100,200,300,500,,B,暂无解析,未设置,电力交易题库_结构化初版.docx,true
q_00051,52,第一章 电力市场基础,multiple,集中式电力市场的代表国家有( ),美国,英国 c.北欧,,澳大利亚 0,,AD,暂无解析,未设置,电力交易题库_结构化初版.docx,true
q_00052,53,第一章 电力市场基础,multiple,电力市场中的交易类型通常包括( ),现货交易,辅助服务,中长期交易,期货交易,,ABCD,暂无解析,未设置,电力交易题库_结构化初版.docx,true
q_00053,54,第一章 电力市场基础,multiple,关于期货交易正确的说法是( ),属于契约交易,期货交易不在交易所公开进行,期货合同可以不进行实物交割,期货交易有信用风险,,AC,暂无解析,未设置,电力交易题库_结构化初版.docx,true
q_00054,55,第一章 电力市场基础,multiple,电力期货市场的风险主要表现在( ),交易者的投机行为,市场信息不对称,市场不完全引发市场失灵,市场门槛过高,,BC,暂无解析,未设置,电力交易题库_结构化初版.docx,true
q_00055,56,第一章 电力市场基础,multiple,零售市场用户的权利和责任包括( ),履行与售电公司签订的零售合约,"在合约有效期内依据合约获取相关方履行合约的信息,审核确认本企业的结算结果并及 时反馈意见",按照市场规则和零售合约承担辅助服务、偏差考核、违约等相关责任,向电网企业支付电费并获取增值税专用发票,,ABCD,暂无解析,未设置,电力交易题库_结构化初版.docx,true
q_00056,57,第一章 电力市场基础,multiple,批发市场用户的权利和责任包括( ),"在交易平台上填制合约结算方式、价格等信息,将合约上传至交易平台备案,在合约有 效期内依据合约获取相关方履行合约的信息,在预结算单据结果公示后审核确认本企业 结算结果并反馈意见",按照市场规则承担辅助服务、偏差考核、违约等相关责任,向电网企业支付电费并获取增值税专用发票,"拥有配电网运营权的售电公司可向用户收取电费并开具增值税专用发票,向电网企业支 付购电费、输电费,并代收政府性基金及政策性交叉补贴,归集至电网企业 ゜",,ABC,暂无解析,未设置,电力交易题库_结构化初版.docx,true
q_00057,58,第一章 电力市场基础,multiple,"以下对部分电力市场改革试点省份的现货与辅助服务市场出清模式的描述,正确的 是( )","以广东电力市场为代表,先进行调频辅助服务市场出清,再开展电能量市场出清,机组 在调频市场的出清结果作为电能量市场的边界条件","以甘肃电力市场为代表,先进行电能量市场出清,再开展调频辅助服务市场出清,电能 量市场出清结果的机组组合作为调频市场的基础","以浙江电力市场为代表,电能量市场与调频辅助服务市场联合出清,机组参与调频市场 的结果作为机组参与实时市场的边界条件","以山西电力市场为代表,电能量市场与调频辅助服务市场联合出清,机组参与调频市场 的结果作为机组参与实时市场的边界条件",,ABC,暂无解析,未设置,电力交易题库_结构化初版.docx,true
q_00058,59,第一章 电力市场基础,multiple,"在电力市场中,考虑网络安全约柬的机组组合的优化日标是( )。 -、不定项选择题",系统成本最小,社会福利最大,系统能耗最低,购电成本最小,,BD,暂无解析,未设置,电力交易题库_结构化初版.docx,true
q_00059,60,第一章 电力市场基础,single,以下关于集中式市场出清说法错误的是( ),市场出清充分考虑了电力系统安全运行约柬,市场出清价格受系统负荷影响,"出现阻塞时,不同地点的市场价格可能不同",节点电价只反映系统供需平衡情况,,D,暂无解析,未设置,电力交易题库_结构化初版.docx,true
q_00060,61,第一章 电力市场基础,single,"经济调度中,节点功率平衡约柬的拉格朗日乘子的经济学含义是( )","节点增加单位负荷需求,导致最大生产成本的增加量","节点增加单位负荷需求,导致线路潮流阻塞程度的增加量","节点增加单位负荷需求,导致机组出力的增加量","节点增加单位负荷需求,导致最小生产成本的增加量",,D,暂无解析,未设置,电力交易题库_结构化初版.docx,true
q_00061,62,第一章 电力市场基础,multiple,大型火电发电机组成本函数的动态约柬主要有( ),启停成本,最低技术出力,最大爬坡速率,最小运行时间,最小停运时间,ABCDE,暂无解析,未设置,电力交易题库_结构化初版.docx,true
q_00062,63,第一章 电力市场基础,multiple,"对于发电厂来说,燃料成本不属于( )",固定成本,核定成本 c.平均成本,,变动成本,,ABC,暂无解析,未设置,电力交易题库_结构化初版.docx,true
q_00063,64,第一章 电力市场基础,single,我国电力市场运行中存在的一大主要问题是现货市场需逐步由( )模式向 )模式转变 (,"单边,多边","单边,双边","双边,单边","多边,单边",,B,暂无解析,未设置,电力交易题库_结构化初版.docx,true
q_00064,65,第一章 电力市场基础,multiple,现代电力系统的主要特点为( ),电源构成、负荷成分等方面发生很大的变化,在运行管理上实现了高度自动化,高压直流输电和柔性交流输电技术得到了广泛应用,电力生产逐步市场化,,ABCD,暂无解析,未设置,电力交易题库_结构化初版.docx,true
q_00065,66,第一章 电力市场基础,multiple,"2022年,我国煤炭产量最多的三个省区是( )",山西,内蒙古,贵州,陕西,,ABD,暂无解析,未设置,电力交易题库_结构化初版.docx,true
q_00066,67,第一章 电力市场基础,multiple,火力发电厂的三大系统包括( ),燃烧系统,废物处理系统,汽水系统,电气系统,,ACD,暂无解析,未设置,电力交易题库_结构化初版.docx,true
q_00067,68,第一章 电力市场基础,single,水轮机的最低水头( ),表明水轮机利用水流单位机械能量的多少,是指保证水轮机发出额定出力的最低水头,是指保证水轮机安全稳定运行的最低工作水头,以上【答案】都不是 ゜,,C,暂无解析,未设置,电力交易题库_结构化初版.docx,true
q_00068,69,第一章 电力市场基础,single,径流式水电站是( ),年调节电站,季调节电站,周调节电站,无调节电站,,D,暂无解析,未设置,电力交易题库_结构化初版.docx,true
q_00069,70,第一章 电力市场基础,multiple,风能的主要优点包括( ),能量巨大,分布广泛,地区差异小,没有污染,,ABD,暂无解析,未设置,电力交易题库_结构化初版.docx,true
q_00070,71,第一章 电力市场基础,single,传统电力系统主力电源是( ),水电,火电 c.风电,,核电,,B,暂无解析,未设置,电力交易题库_结构化初版.docx,true
q_00071,72,第一章 电力市场基础,single,组成传统电力系统的主要元件是( ),电源、电阻、电感、电容,发电机、变压器、线路、用电设备,发电厂、变电站、变压器、线路,发电机、变压器、线路、开关,,B,暂无解析,未设置,电力交易题库_结构化初版.docx,true
q_00072,73,第一章 电力市场基础,single,1Mwh等于( )电能,1000kWh,10万kWh,,,,,暂无解析,未设置,电力交易题库_结构化初版.docx,true
q_00073,0,第一章 电力市场基础,multiple,1万kWh,,,,1000度 O,,ACD,暂无解析,未设置,电力交易题库_结构化初版.docx,true
q_00074,74,第一章 电力市场基础,single,发电利用小时数等于( ),实际发电量/发电设备平均容量,发电设备平均容量/实际发电量,实际上网电量/发电设备平均容量,发电设备平均容量/实际上网电量,,A,暂无解析,未设置,电力交易题库_结构化初版.docx,true
q_00075,75,第一章 电力市场基础,single,"用电负荷曲线有着明显的高峰低谷现象,通过划分峰谷时段来确定( )促使用 户自觉地调整用电方式,通过用户对电价的响应来达到削峰填谷的目的",季节电价,分时电价,实时电价,阶梯电价,,B,暂无解析,未设置,电力交易题库_结构化初版.docx,true
q_00076,76,第一章 电力市场基础,single,"一般情况下在同一电力系统中,要保证任一瞬间的( )都在全网统一范围内",电压,频率,波形,电流,,B,暂无解析,未设置,电力交易题库_结构化初版.docx,true
q_00077,77,第一章 电力市场基础,single,最佳的备用容量必定是系统( )相互协调的结果,稳定性和安全性,随机性和经济性,灵活性和经济性,可靠性和经济性,,D,暂无解析,未设置,电力交易题库_结构化初版.docx,true
q_00078,78,第一章 电力市场基础,single,"( )主要反映发电厂的圃定成本,与发电厂类型、投资费用、还贷利率和折旧 方式等相关",容量电价,电量电价,销售电价,输配电价,,A,暂无解析,未设置,电力交易题库_结构化初版.docx,true
q_00079,79,第一章 电力市场基础,single,电力供需的实时平衡特性要求装机容量必须满足( ),最小负荷需求,最大负荷需求及必要的负荷备用容量,平均负荷需求,中位负荷需求 ③,,B,暂无解析,未设置,电力交易题库_结构化初版.docx,true
q_00080,80,第一章 电力市场基础,multiple,自动发电控制的作用在于解决( ),快速负荷波动问题,负荷大幅度波动问题,计划性的负荷波动问题,难以预测的较小程度发电变化问题,,AD,暂无解析,未设置,电力交易题库_结构化初版.docx,true
q_00081,81,第一章 电力市场基础,single,国调及分中心主要负责电网( ) Ⅳ以上主网调度运行'指挥直调范围内电网的 运行、操作和故障处置。,500,330 c. 220,,750,,A,暂无解析,未设置,电力交易题库_结构化初版.docx,true
q_00082,82,第一章 电力市场基础,multiple,"在无功功率不足的条件下,以下说法中正确的是( )",采取调整变压器分接头的办法来提高电压,调整发电机机端电压来提高电压,投入并联电容来提高电压,调整调相机机端电压来提高电压 门l,,BCD,暂无解析,未设置,电力交易题库_结构化初版.docx,true
q_00083,83,第一章 电力市场基础,single,N-1安全分析的目的是( ),分析系统中某台设备停运对系统安全性的影响,分析系统中所有设备停运对系统安全性的影响,分析系统中任意一台设备停运对系统安全性的影响,分析系统中两台设备停运对系统安全性的影响,,C,暂无解析,未设置,电力交易题库_结构化初版.docx,true
q_00084,84,第一章 电力市场基础,multiple,"根据用电设备的重要性和对供电可靠性的要求,通常将电力负荷分为( )",核电,水电,风电,太阳能发电,,ABCD,暂无解析,未设置,电力交易题库_结构化初版.docx,true
