id,qno,chapter,questionType,stem,optionA,optionB,optionC,optionD,optionE,correctAnswer,analysis,difficulty,source,isActive
q_01979,33,第十章 电力市场政策解析,judge,电力现货市场结算可以设置不平衡资金池。 ( ),,,,,,错误,暂无解析,未设置,电力交易题库_结构化初版.docx,true
q_01980,34,第十章 电力市场政策解析,judge,"垃圾发电同新能源发电一样,以燃煤发电基准价作为其价格形成的挂钩基准",,,,,,错误,暂无解析,未设置,电力交易题库_结构化初版.docx,true
q_01981,35,第十章 电力市场政策解析,judge,跨区跨省专项工程输电价格实行单一电量电价制。 ( ),,,,,,正确,暂无解析,未设置,电力交易题库_结构化初版.docx,true
q_01982,36,第十章 电力市场政策解析,judge,"对于参与跨区跨省可再生能源增量现货交易,如最优价格路径已满送,通过其他具 有空余输送能力的专项工程送电的,按其他专项工程路径价格执行。 ( )",,,,,,错误,暂无解析,未设置,电力交易题库_结构化初版.docx,true
q_01983,37,第十章 电力市场政策解析,judge,输配电价改革的重点是改革和规范电网企业运营模式 ( ),,,,,,正确,暂无解析,未设置,电力交易题库_结构化初版.docx,true
q_01984,38,第十章 电力市场政策解析,judge,"取消工商业目录销售电价后, 5Ⅳ及以上用户原则上要直接参与市场交易,直接向 发电企业或售电公司购电,暂无法直接参与市场交易的可由电网企业代理购电。 ( )",,,,,,错误,暂无解析,未设置,电力交易题库_结构化初版.docx,true
q_01985,39,第十章 电力市场政策解析,judge,"根据《国家发展改革委关于进一步完善分时电价机制的通知》 (发改价格〔2021〕 1093号),要建立尖峰电价机制,尖峰电价在峰段电价基础上上浮比例原则上不低于15%。 ( )",,,,,,错误,暂无解析,未设置,电力交易题库_结构化初版.docx,true
q_01986,40,第十章 电力市场政策解析,judge,电量电价随区域电网实际交易电量收取;容量电价随各省级电网终端销售电量(含 市场化交易电量)收取。 ( ),,,,,,错误,暂无解析,未设置,电力交易题库_结构化初版.docx,true
q_01987,41,第十章 电力市场政策解析,judge,"加强煤、电市场监管。严禁对合理区间内的煤、电价格进行不当行政干预,可适当 对商耗能企业给予电价优惠。 ( )",,,,,,错误,暂无解析,未设置,电力交易题库_结构化初版.docx,true
q_01988,42,第十章 电力市场政策解析,judge,"按照《国家发展改革委关于第三监管周期区域电网输电价格及有关事项的通知》 (发改价格〔2023〕 S32号), 100-315kvA之间的工商业用户,执行单一制或两部制电价。",,,,,,错误,暂无解析,未设置,电力交易题库_结构化初版.docx,true
q_01989,43,第十章 电力市场政策解析,judge,"各地可结合当地电力市场发展情况,暂缓减小电网企业代理购电范围。 ( )",,,,,,错误,暂无解析,未设置,电力交易题库_结构化初版.docx,true
q_01990,44,第十章 电力市场政策解析,judge,"参与绿电交易的电力用户、售电公司,其购电价格由绿色电力交易价格、上网环节 线损费用、输配电价、系统运行费用、政府性基金及附加等构成。 ( )",,,,,,正确,暂无解析,未设置,电力交易题库_结构化初版.docx,true
q_01991,45,第十章 电力市场政策解析,judge,新建煤电机组自投运当月起执行煤电容量电价机制。 ( ),,,,,,错误,暂无解析,未设置,电力交易题库_结构化初版.docx,true
q_01992,46,第十章 电力市场政策解析,judge,"根据《关于加快推进电力现货市场建设工作的通知》 (发改(2022) 129号),不得 在交易出清、结算环节设置不合理限价或费用疏导上限。 ( )",,,,,,正确,暂无解析,未设置,电力交易题库_结构化初版.docx,true
q_01993,47,第十章 电力市场政策解析,judge,我国在2021年正式启动绿证交易。 ( ),,,,,,错误,暂无解析,未设置,电力交易题库_结构化初版.docx,true
q_01994,48,第十章 电力市场政策解析,judge,"《国家发展改革委办公厅国家能源局综合司关于有序推进绿色电力交易有关事项的 通知》 (发改办体改〔2022〕 821号)中明确应健全特殊用户绿色电力消费社会责任,高耗 能企业绿电消费比例原则上应超过全社会平均水平,且不低于当地可再生能源消纳责任权 重。 ( )",,,,,,错误,暂无解析,未设置,电力交易题库_结构化初版.docx,true
q_01995,49,第十章 电力市场政策解析,judge,绿证核发对象为列入国家可再生能源电价附加补助目录内的陆上风电、光伏发电、 海上风电、水电等。 ( ),,,,,,错误,暂无解析,未设置,电力交易题库_结构化初版.docx,true
q_01996,50,第十章 电力市场政策解析,judge,"《国家发展改革委财政部国家能源局关于做好可再生能源绿色电力证书全覆盖工 作促进可再生能源电力消费的通知》 (发改能源〔2023〕 1044号)废止了原有绿证制度,重 新明确了绿证的功能和核发范围,规范了绿证核发和流通方式,就鼓励全社会消费绿色电 力提出了要求。 ( )",,,,,,正确,暂无解析,未设置,电力交易题库_结构化初版.docx,true
q_01997,51,第十章 电力市场政策解析,judge,国家可再生能源信息中心负责开展绿证交易组织、结算、绿证核发与划转等流通环 节各项工作。 ( ),,,,,,错误,暂无解析,未设置,电力交易题库_结构化初版.docx,true
q_01998,52,第十章 电力市场政策解析,judge,"国家可再生能源信息中心以周为单位,按照1个绿证对应1Mwh可再生能源实际上 网电量的标准,根据可再生类型发电类型、补贴等情况,向发电企业核发相应证书。 ( )",,,,,,错误,暂无解析,未设置,电力交易题库_结构化初版.docx,true
q_01999,53,第十章 电力市场政策解析,judge,"国家可再生能源信息中心按照国家有关规定对达到有效期的绿证进行注销,并将注 销信息及时同步至北京电力交易中心。已注销绿证重新核发后方可参与交易゜ ( )",,,,,,错误,暂无解析,未设置,电力交易题库_结构化初版.docx,true
q_02000,54,第十章 电力市场政策解析,judge,"根据《关于进一步做好新增可再生能源消费不纳入能源消费总量控制有关工作的通 知》,可再生能源绿色电力证书是新能源电力消费的唯一凭证。 ( )",,,,,,正确,暂无解析,未设置,电力交易题库_结构化初版.docx,true
q_02001,55,第十章 电力市场政策解析,judge,"已按规定核准(备案)、全部机组完成并网、同时经审核纳入补贴日录的可再生能 源发电项目,按保障利用小时数核定中央财政补贴额度。 ( )",,,,,,错误,暂无解析,未设置,电力交易题库_结构化初版.docx,true
q_02002,56,第十章 电力市场政策解析,judge,"自2021年起,国家财政资金不再为新安排的新增风电、太阳能发电项目提供电价补 贴,生物质能发电电价补贴也启动竟争配置确定电价并在几年内逐步退出电价补贴",,,,,,错误,暂无解析,未设置,电力交易题库_结构化初版.docx,true
q_02003,57,第十章 电力市场政策解析,judge,可再生能源发电项目的保障性收购电量应主要由电网企业承担收购义务的电量,,,,,,错误,暂无解析,未设置,电力交易题库_结构化初版.docx,true
q_02004,58,第十章 电力市场政策解析,judge,"《国家发展改革委国家统计局国家能源局关于进一步做好新增可再生能源消费不 纳入能源消费总量控制有关工作的通知》 (发改运行〔2022〕 1258号)提出,绿证是可再生 能源电力消费的凭证,企业可再生能源消费量以持有绿证作为核算基准゜ ( )",,,,,,错误,暂无解析,未设置,电力交易题库_结构化初版.docx,true
q_02005,59,第十章 电力市场政策解析,judge,"当分布式发电项目总装机容量大于供电范围上年度平均用电负荷时, ""过网费""执 行本电压等级的过网费标准。 ( )",,,,,,错误,暂无解析,未设置,电力交易题库_结构化初版.docx,true
q_02006,60,第十章 电力市场政策解析,judge,"煤电容量电价机制适用于合规在运的公用煤电机组。燃煤自备电厂、不符合国家规 划的煤电机组,以及不满足国家对于能耗、环保和灵活调节能力等要求的煤电机组,不执 行容量电价机制。 ( ) e l.在系统观念的引领下,如何定位新型电力系统? 务构建新发展格局,加快构建现代化产业体系,必须推进碳达峰碳中和,加快推动能源清 洁低碳转型;必须保障国家能源安全,立足我国能源资源票赋,全面提升能源自主供给能 九必须推动能源高质量发展,破解能源安全、环境可持续和能源公平的能源""不可能三 角""问题 e",,,,,,"新型电力系统必须融入中国式现代化建设;全方位满足人民美好生活需要,必须服",暂无解析,未设置,电力交易题库_结构化初版.docx,true
q_02007,2,第十章 电力市场政策解析,short,新型电力系统的特征是什么?,,,,,,新型电力系统的特征清洁低碳、安全充裕、经济高效、供需协同、灵活智能。,暂无解析,未设置,电力交易题库_结构化初版.docx,true
q_02008,3,第十章 电力市场政策解析,short,"新型电力系统在新型能源体系中的价值是什么? 电力将推动形成更加开放柔性的能源互联网发展环境,催生数据整合商、运营零售商、综 合服务商、金融服务商等新的市场主体,提供基于信息增值的系列能源电力服务,满足用 户多样化、个性化、互动化需求。在此基础上,推动形成能源工业互联网、电碳综合配置 平台等全新产业生态,激发电力的平台生态价值 e",,,,,,"电力带来数据价值、服务价值和平台生态价值,带动能源领域实现价值的全面跃升。",暂无解析,未设置,电力交易题库_结构化初版.docx,true
q_02009,4,第十章 电力市场政策解析,judge,如何构建适应新型电力系统的市场机制? ③探索开展绿色电力交易。 ④健全分布式发电市场化交易机制。,,,,,,正确,暂无解析,未设置,电力交易题库_结构化初版.docx,true
q_02010,5,第十章 电力市场政策解析,short,"现阶段,应如何完善新型电力系统建设和运行机制? 电网体系。 ③健全适应新型电力系统的市场机制。 ④完善灵活性电源建设和运行机制。 ⑤完善电力需求响应机制。 ⑥探索建立区域综合能源服务机制 e",,,,,,①加强新型电力系统顶层设计。 ②完善适应可再生能源局域深度利用和广域输送的,暂无解析,未设置,电力交易题库_结构化初版.docx,true
q_02011,6,第十章 电力市场政策解析,judge,"加强新型电力系统的市场协同,主要有哪些做法? 段实现多能互补,为新型电力系统带来增量调节和替代资源,推动电力市场和碳排放权市 场同步建设,促使市场政策协同、市场空间匹配、交易机制衔接、价格机制联动在支撑 ""双碳""日标和构建新型电力系统中形成合力;推动多种绿色交易市场在政策、交易和技术 等关键方面的协同,建立高效协同的节能降碳管理市场机制,推动新型电力系统全环节减 污降碳协同增效 e",,,,,,正确,暂无解析,未设置,电力交易题库_结构化初版.docx,true
q_02012,7,第十章 电力市场政策解析,short,"《中共中央国务院关于进一步深化电力体制改革的若干意见》 (中发〔2015〕 9号) 中指出深化电力体制改革的总体目标是什么? 合理、监管有效""的市场体制,努力降低电力成本、理顺价格形成机制、逐步打破垄断、 有序开放竟争性业务,实现供应多元化,调整产业结构、提升技术水平、控制能源消费总 量,提高能源利用效率、提高安全可靠性,促进公平竟争、促进节能环保。",,,,,,"通过改革,建立健全电力行业""有法可依、政企分开、主体规范、交易公平、价格",暂无解析,未设置,电力交易题库_结构化初版.docx,true
q_02013,8,第十章 电力市场政策解析,short,"《中共中央国务院关于进一步深化电力体制改革的若干意见》 (中发〔2015〕 9号) 中指出深化电力体制改革的路径是什么? 的体制架构,有序放开输配以外的竞争性环节电价,有序向社会资本放开配售电业务,有 序放开公益性和调节性以外的发用电计划;推进交易机构相对独立,规范运行;继续深化 对区域电网建设和适合我国国情的输配体制研究;进一步强化政府监管,进一步强化电力 统筹规划,进一步强化电力安全高效运行和可靠供应 e",,,,,,"在进一步完善政企分开、厂网分开、主辅分开的基础上,按照管住中间、放开两头",暂无解析,未设置,电力交易题库_结构化初版.docx,true
q_02014,9,第十章 电力市场政策解析,short,"电力交易机构的主要职责是什么? 算依据和相关服务,汇总电力用户与发电企业自主签订的双边合同;负责市场主体注册和 相应管理,披露和发布市场信息等 e lO.推进电力市场建设的主要任务有哪些? 先购电、优先发电制度。 ④建立相对稳定的中长期交易机制。 ⑤完善跨区跨省电力交易机 制。 ⑥建立有效竟争的现货交易机制。 ⑦建立辅助服务交易机制。 ⑧形成促进可再生能 源利用的市场机制。 ⑨建立市场风险防范机制 e ll.集中式市场中的机组次日发电计划如何生成? 确定日次全部发用电量和发用电曲线形成。",,,,,,集中式市场中的机组次日发电计划由发电企业、用户和售电主体通过现货市场竟价,暂无解析,未设置,电力交易题库_结构化初版.docx,true
q_02015,12,第十章 电力市场政策解析,short,"根据《北京电力交易中心有限公司关于电力交易机构推进全国统一电力市场建设的 有关工作意见》,容量补偿机制的主要建设内容有哪些? 量市场过渡的方式和路径,探索容量市场建设, 2030年,推动具备条件省份容量补偿机制 正式运行,初步形成容量市场建设方案",,,,,,"建设我国市场化发电容量补偿机制,以容量补偿机制起步,研究容量补偿机制向容",暂无解析,未设置,电力交易题库_结构化初版.docx,true
q_02016,13,第十章 电力市场政策解析,short,"《关于积极推进电力市场化交易进一步完善交易机制的通知》 (发改运行〔2018〕 1027号)中提出的市场化定价机制主要内容是什么? 目录电价或电煤中长期合同燃料成本及上年度市场交易平均价格等,由发电企业和电力用 户、售电企业自愿协商或市场竞价等方式形成。在确定基准电价的基础上,鼓励交易双方 在合同中约定价格浮动调整机制。鼓励建立与电煤价格联动的市场交易电价浮动机制。",,,,,,"文件提出协商建立""基准电价+浮动机制""的市场化定价机制,基准电价可以参考现行",暂无解析,未设置,电力交易题库_结构化初版.docx,true
q_02017,14,第十章 电力市场政策解析,short,"简述《关于进一步深化燃煤发电上网电价市场化改革的通知》 (发改价格〔2021〕 1439号)文中″四项改革""的内容。 动土商业用户都进入市场。 ④保持居民、农业用电价格稳定 e",,,,,,①有序放开全部燃煤发电电量上网电价。 ②扩大市场交易电价上下浮动范围。 ③推,暂无解析,未设置,电力交易题库_结构化初版.docx,true
q_02018,15,第十章 电力市场政策解析,short,"根据《国家发展改革委办公厅国家能源局关于进一步做好电力现货市场建设试点 工作的通知》 (发改办体改〔2023〕 813号),现货试点改革探索的主要任务有哪些? 展中长期、现货与辅助服务交易。 ④做好本地市场与省间市场的衔接。 ⑤稳妥有序推动新 能源参与电力市场。 ⑥探索容量成本回收机制。 ⑦建立合理的费用疏导机制 e",,,,,,①合理确定电力现货市场主体范围。 ②推动用户侧参与现货市场结算。 ③统筹开,暂无解析,未设置,电力交易题库_结构化初版.docx,true
q_02019,16,第十章 电力市场政策解析,short,交叉补贴的来源包括哪些类型? 负荷特性用户之间的交叉补贴。 ④不同地区之间用户的交叉补贴 e,,,,,,①不同类型用户之间的交叉补贴。 ②不同电压等级用户之间的交叉补贴。 ③不同,暂无解析,未设置,电力交易题库_结构化初版.docx,true
q_02020,17,第十章 电力市场政策解析,short,电网企业应按要求及时公开哪些代理购电信息? 差、采购电量电价结构及水平、市场化机组剩余容量相关情况、代理购电用户电价水平及 构成、代理购电用户电量和电价执行情况等信息 e,,,,,,原则上电网企业应按月发布代理用户分月总电量预测、相关预测数据与实际数据偏,暂无解析,未设置,电力交易题库_结构化初版.docx,true
q_02021,18,第十章 电力市场政策解析,short,分布式发电市场化交易模式目前主要有哪些? 企业代售电。 ③电网企业按国家核定的各类发电的标杆上网电价收购并在ⅡOkv及以下的 配电网内就近消纳。,,,,,,①分布式发电项目与电力用户进行电力直接交易。 ②分布式发电项目单位委托电网,暂无解析,未设置,电力交易题库_结构化初版.docx,true
q_02022,19,第十章 电力市场政策解析,short,"分布式发电""过网费""的确定标准是什么? 市场化交易双方所占用的电网资产、电压等级和电气距离,按接入电压等级和输电及电力 消纳范围分级确定 e",,,,,,"分布式发电""过网费""的核算,应在遵循国家核定输配电价基础上,考虑分布式发电",暂无解析,未设置,电力交易题库_结构化初版.docx,true
q_02023,20,第十章 电力市场政策解析,short,"电力需求侧管理的内容有哪些? 资源,在用电环节实施需求响应、节约用电、电能替代、绿色用电、智能用电、有序用电, 推动电力系统安全降碳、提效降耗。",,,,,,"加强全社会用电管理,综合采取合理可行的技术、经济和管理措施,优化配置电力",暂无解析,未设置,电力交易题库_结构化初版.docx,true
q_02024,21,第十章 电力市场政策解析,essay,"可再生能源发电项目的上网电量如何进行全额消纳? 家可再生能源消纳保障机制、比重目标等相关规定,应由电力市场相关成员承担收购义务 的电量。市场交易电量通过市场化方式形成价格的电量,由售电企业和电力用户等电力市 场相关成员共同承担收购责任。",,,,,,可再生能源上网电量包括保障性收购电量和市场交易电量。保障性收购电量按照国,暂无解析,未设置,电力交易题库_结构化初版.docx,true
q_02025,22,第十章 电力市场政策解析,essay,"市场运营机构和电网企业应该如何组织进行可再生能源电量的收购? 调度机构应落实可再生能源发电项目保障性电量收购政策要求,并保障已达成市场交易电 量合同的执行;电网企业应组织电力市场相关成员,确保可再生能源发电项目保障性收购 电量的消纳。",,,,,,"电力交易机构应组织电力市场相关成员,推动可再生能源发电项目参与市场交易;",暂无解析,未设置,电力交易题库_结构化初版.docx,true
q_02026,1,第十章 电力市场政策解析,essay,"《中共中央国务院关于进一步深化电力体制改革的若干意见》 (中发〔2015〕号)相 比于《电力体制改革方案》 (国发〔2002〕 5号)有哪些继承和超越? 国家已明确了""能源革命""战略构想,并决定全面建设""法治社会""。因此中发9号文体现 的核心价值取向已有本质不同,主要体现在以下四个方面: ①本次新电改旨在建立一个绿 色低碳、节能减排、安全可靠、综合资源优化配置的新型电力治理体系,推动能源电力生 产、消费及技术结构整体转型。 ②不考虑输配分开和电网调度独立。 ③明确建设新的电力 体制规划方法和体系,以适应可再生能源的大规模并网运行。 ④改革关键不在于电力企业 的拆分重组和盈利模式的改变,而在于新型电力治理体系管理框架的顶层设计,如何发挥 政府在改革政策激励和法治环境设计上的市场化导向作用。",,,,,,"两个电改方案都围绕""放开两头,管住中间""这个基本路径,但中发9号文提出时",暂无解析,未设置,电力交易题库_结构化初版.docx,true
q_02027,2,第十章 电力市场政策解析,essay,"如何加强新型电力系统顶层设计? 力系统发展战略和总体规划,鼓励各类企业等主体积极参与新型电力系统建设。对现有电 力系统进行绿色低碳发展适应性评估,在电网架构、电源结构、源网荷储协调、数字化智 能化运行控制等方面提升技术和优化系统。加强新型电力系统基础理论研究,推动关键核 心技术突破,研究制定新型电力系统相关标准。推动互联网、数字化、智能化技术与电力 系统融合发展,推动新技术、新业态、新模式发展,构建智慧能源体系。加强新型电力系 统技术体系建设,开展相关技术试点和区域示范。",,,,,,"推动电力来源清洁化和终端能源消费电气化,适应新能源电力发展需要制定新型电",暂无解析,未设置,电力交易题库_结构化初版.docx,true
q_02028,3,第十章 电力市场政策解析,essay,"简述全国统一电力市场建设的总体目标゜ 同运行,电力中长期、现货、辅助服务市场一体化设计、联合运营,跨区跨省资源市场化 配置和绿色电力交易规模显著提高,有利于新能源、储能等发展的市场交易和价格机制初 步形成。到2030年,全国统一电力市场体系基本建成,适应新型电力系统要求,国家市场 与省(区、市) /区域市场联合运行,新能源全面参与市场交易,市场主体平等竞争、自主 选择,电力资源在全国范围内得到进一步优化配置。",,,,,,"到2025年,全国统一电力市场体系初步建成,国家市场与省(区、市) /区域市场协",暂无解析,未设置,电力交易题库_结构化初版.docx,true
q_02029,4,第十章 电力市场政策解析,essay,"谈一谈如何构建适应新型电力系统的全国统一电力市场体系? 业模式创新。要推动有效市场同有为政府更好结合不断完善政策体系,做好电力基本公共 服务供给。第一,要健全多层次统一电力市场体系。加快建设国家电力市场,稳步推进省 级/区域电力市场建设,引导各层次电力市场协同运行,有序推进跨省区市场间开放合作。 第二,要完善统一电力市场体系功能。要持续推动电力中长期市场建设,积极稳妥推进电 力现货市场建设,完善电力辅助服务市场,培育多元竟争的市场主体。第三,要健全统一 电力市场体系的交易机制。要规范统一市场基本交易规则和技术标准,完善电力价格形成 机制,做好市场化交易和调度运行的高效衔接,加强信息共享和披露。第四,要强化电力 统筹规划和科学监管。健全适应市场化环境的电力规划体系,完善市场监管体制,健全市 场信用体系和应急保障机制。第五,要构建适应新型电力系统的市场机制。提升市场对高 比例新能源的适应性,建立发电容量成本回收机制,探索绿电交易,健全分布式发电市场 化交易机制。",,,,,,"要健全适应新型电力系统的体制机制,推动加强电力技术创新、市场机制创新、商",暂无解析,未设置,电力交易题库_结构化初版.docx,true
q_02030,5,第十章 电力市场政策解析,essay,"简述传统电力市场和新型电力市场的区别。 运行模式等方面存在不同。在交易品种方面,传统电力市场的中长期交易主要以场外协商 为主,周期长、频次低、偏差大;现货市场与实际运行兼容性不足,新型电力市场的长期 市场价值凸显,中长期连续运营不断向短期逼近,中长期分散交易与中短期集中优化相结 合。在市场范围方面,传统电力市场采用省间、省内市场两级运作,但存在壁垒,新型主 体参与不足;新型电力市场省间、区域、省内市场协同运行,形成输电权与电能量、批发 与零售协同。在市场目标方面,传统电力市场主要实现电力经济运行,新型电力市场兼顾 安全、绿色、经济多元目标,绿色电力、电一碳协同、电能量与平衡市场联合优化。在市场 主体方面,传统电力市场发电侧以化石能源为主,另外主要有售电公司和传统电力用户, 新型电力市场中大规模新能源接入、多能源互动,储能、虚拟电厂、负荷聚合商等新型市 场主体入市。在运行模式方面,传统电力市场发电侧集中优化、源随荷动;新型电力市场 采用发电侧集中优化和市场主体分散决策,源网荷储互动。",,,,,,传统电力市场与新型电力市场主要在交易品种、市场范围、市场目标、市场主体、,暂无解析,未设置,电力交易题库_结构化初版.docx,true
