id,qno,chapter,questionType,stem,optionA,optionB,optionC,optionD,optionE,correctAnswer,analysis,difficulty,source,isActive
q_01392,48,第六章 市场合同,multiple,"根据《国家电网有限公司关于进一步服务电力零售市场建设与规范运营的通知》 (国家电网交易〔2023〕 306号),基于标准化零售套餐,建立完善( )、 ( )的零售 市场合同文本,纳入相关交易规则",标准化,规范化,结构化,模式化 O,,AC,暂无解析,未设置,电力交易题库_结构化初版.docx,true
q_01393,49,第六章 市场合同,multiple,"根据《国家电网有限公司关于进一步服务电力零售市场建设与规范运营的通知》 (国 家电网交易〔2023〕 306号),提升零售合同签订灵活性,建立完善年度、月度合同签订、解 除和套餐变更等机制,有效适应中长期连续运营以及现货市场运行需要,有序衔接零售合同 )与( )、 ( ),防范电力用户无合同运行或同时签订多家售电公司等风险 (",签订,履约,解除,变更,,BCD,暂无解析,未设置,电力交易题库_结构化初版.docx,true
q_01394,50,第六章 市场合同,single,"根据《国家电网有限公司关于推进绿电绿证市场建设助力能源消费绿色低碳转型的 通知》 (国家电网交易〔2022〕 710号),要严格遵守绿电交易的定义、市场规则和管理流 程,健全完善省内绿电交易市场,实现年、季、月常态开市,月内连续运营,开展绿电交 易( ),促进绿电市场平稳高效运营",合同订立,合同分解,合同转让,合同调整,,C,暂无解析,未设置,电力交易题库_结构化初版.docx,true
q_01395,51,第六章 市场合同,single,"根据《关于推进售电侧改革的实施意见》的通知,发电公司、电网企业、售电公司 和用户应根据有关电力交易规则,按照自愿原则签订( )。电力交易机构负责提供结算 依据,电网企业负责收费、结算,负责归集交叉补贴,代收政府性基金,并按规定及时向 有关发电公司和售电公司支付电费",三方意向,三方协议,三方合同,三方签章,,C,暂无解析,未设置,电力交易题库_结构化初版.docx,true
q_01396,52,第六章 市场合同,multiple,"根据《国家发展改革委国家能源局关于做好2023年电力中长期合同签订履约工作 的通知》 (发改运行(2022〕 1861号),为确保市场主体高比例签约提出的措施包括 ( )",推进电力中长期合同电子化运转,鼓励签订多年中长期合同,推动优先发电计划通过电力中长期合同方式落实,完善分时段交易组织方式,,ABC,暂无解析,未设置,电力交易题库_结构化初版.docx,true
q_01397,53,第六章 市场合同,single,"现货运行后,若用户未对某一笔年度分月中长期双边协商交易合同进行分解'电力 交易中心的处理方法应是( )。","将该合同进行均分,后续允许进行调整",不做处理,"将该合同进行均分,后续不允许调整",将该合同终止,,A,暂无解析,未设置,电力交易题库_结构化初版.docx,true
q_01398,54,第六章 市场合同,multiple,购售电合同约定的争议解决方式包括( ),申诉,协商,调解,仲裁,,BCD,暂无解析,未设置,电力交易题库_结构化初版.docx,true
q_01399,55,第六章 市场合同,multiple,"金融合同仅约定财务交割责任,不作为市场主体发用电计划制订依据,其交易形式 包括( )",远期,期货,期权,互换,,ABCD,暂无解析,未设置,电力交易题库_结构化初版.docx,true
q_01400,56,第六章 市场合同,multiple,以下需要执行国家电网公司购售电输电类统一合同文本的是( ),跨区跨省电能交易购售电合同,抽水蓄能电站购售电合同,是购电合同,高压供用电合同 ゜,,ABC,暂无解析,未设置,电力交易题库_结构化初版.docx,true
q_01401,57,第六章 市场合同,single,中长期交易在非现货集中式市场模式下的合同类型及处理合同偏差的方式分别为 ( ),物理合同、日清月结,物理合同、月清月结,差价合约、日清月结,差价合约、月清月结,,D,暂无解析,未设置,电力交易题库_结构化初版.docx,true
q_01402,58,第六章 市场合同,single,中长期交易在非现货分散式市场模式下的合同类型及处理合同偏差的方式分别为 ( ),物理合同、日清月结,物理合同、月清月结,差价合约、日清月结,差价合约、月清月结,,B,暂无解析,未设置,电力交易题库_结构化初版.docx,true
q_01403,59,第六章 市场合同,single,《中华人民共和国合同法》规定:合同成立的地点是( ),合同签订地,合同承诺生效地,当事人户籍所在地,当事人主营业地,,B,暂无解析,未设置,电力交易题库_结构化初版.docx,true
q_01404,60,第六章 市场合同,single,《购售电合同》为《中华人民共和国合同法》中的( ),委托合同,买卖合同,保管合同,借贷合同 O,,B,暂无解析,未设置,电力交易题库_结构化初版.docx,true
q_01405,61,第六章 市场合同,single,"根据《电力交易平台术语》 (Q/GDW lO821-T2021),合同备案是指将签订的合同或 协议上报到( )进行备案的过程",电力主管部门,电力监管机构,电力主管部门及电力监管机构,第三方平台,,C,暂无解析,未设置,电力交易题库_结构化初版.docx,true
q_01406,62,第六章 市场合同,single,"下列关于购售电合同签订要求的说法,不正确的是( )","发电厂购售电合同原则上应由省级及以上电网公司直接组织签订。其中,非统调电厂购 售电合同可委托所辖地区供电公司组织签订,不再需要省级及以上公司审批","签订购售电合同的发电厂应具有独立的法人资质,或拥有上级法人单位的书面授权","对未经国家有关部门审批或核准、未按规定组织验收或验收不合格的发电厂,不得与其 签订购售电合同。对于未持有发电业务许可证的发电企业,须经电力监管机构同意后, 签订购售电合同","凡执行政府下达年度发电计划的,年度购售电合同的签订工作应在接收到政府年度计划后 的一个月内完成;其他购售电合同的签订工作原则上在合同期限到来前一个月之前完成",,A,暂无解析,未设置,电力交易题库_结构化初版.docx,true
q_01407,63,第六章 市场合同,single,"下列关于购售电合同管理工作的说法,不正确的是( )","与统调电厂签订的所有购售电合同,均应报相应的电力监管机构备案。非统调电厂购售 电合同备案可以根据实际情况参照执行","属于备案范围内的年度购售电合同应在签订并生效后的一个月内,报相应的电力监管机 构备案","与统调电厂签订的短期购售电合同,可以在每季度首月的前15个工作日内,报相应的电 力监管机构备案。没有签订短期合同的,应将交易凭证存档检查","当政府有关部门年中重新调整年度发电量计划时,如购售电合同对计划调整事项作出约 定的,不必另行签订合同,同时可将调整计划文件的复印件向相应的电力监管机构报备",,B,暂无解析,未设置,电力交易题库_结构化初版.docx,true
q_01408,1,第六章 市场合同,blank,"中长期合约要素主要包括合约起止时间、合约电量、交易价格、 ( )等要素,以 电子合同的方式签订。",,,,,,交易曲线,暂无解析,未设置,电力交易题库_结构化初版.docx,true
q_01409,2,第六章 市场合同,blank,"跨区跨省交易中,合同变更指购售双方对( )部分交易电量、电力曲线、价格 等进行协商变更,交易方式主要为( )。",,,,,,未执行 双边协商,暂无解析,未设置,电力交易题库_结构化初版.docx,true
q_01410,3,第六章 市场合同,blank,"各级调控机构依据电力市场规则、有关合同或者协议,实施( )、 ( )、 )调度。 (",,,,,,公平 公开 公正,暂无解析,未设置,电力交易题库_结构化初版.docx,true
q_01411,4,第六章 市场合同,blank,发电企业、电力用户、售电公司等市场主体要牢圃树立市场意识、法律意识、契约 意识、 ( )。,,,,,,信用意识,暂无解析,未设置,电力交易题库_结构化初版.docx,true
q_01412,5,第六章 市场合同,blank,"根据《北京电力交易中心绿色电力交易实施细则(修订稿)》 (京电交市〔2023〕仙 号),市场主体应事先明确( )偏差补偿方式,并列入合同条款。",,,,,,绿色电力环境价值,暂无解析,未设置,电力交易题库_结构化初版.docx,true
q_01413,6,第六章 市场合同,blank,"根据《北京电力交易中心跨区跨省电力中长期交易实施细则(修订稿)》 (京电交市 〔2022〕 26号),跨区跨省电力中长期电力用户按照细则参与跨区跨省交易,签订和履行交 易合同,提供交易所必需的电力电量需求、 ( )以及相关生产信息。",,,,,,典型负荷曲线,暂无解析,未设置,电力交易题库_结构化初版.docx,true
q_01414,7,第六章 市场合同,blank,"在跨区跨省交易中,合同转让指合同其中一方经蕾主体对( )的合同全部或部 分转让给( )。",,,,,,未履行 第三方,暂无解析,未设置,电力交易题库_结构化初版.docx,true
q_01415,8,第六章 市场合同,blank,跨区跨省中有关合同的交易包括合同( )、 ( )。,,,,,,变更 转让,暂无解析,未设置,电力交易题库_结构化初版.docx,true
q_01416,9,第六章 市场合同,blank,"根据《售电公司管理办法》 (发改体改规〔2021〕 1钧5号),售电公司与电力用户签 订合同内容应包括合同期限、电量及分月计划、费用结算、 ( )。",,,,,,用户偏差处理方式,暂无解析,未设置,电力交易题库_结构化初版.docx,true
q_01417,10,第六章 市场合同,blank,"根据《电力中长期交易基本规则》 (发改能源规〔2020〕 889号),各相关市场成员 可将电力交易机构出具的( )视同为电子合同作为执行依据。",,,,,,电子交易确认单,暂无解析,未设置,电力交易题库_结构化初版.docx,true
q_01418,11,第六章 市场合同,blank,市场主体签订的跨省跨区交易合同是( )与( )的法律依据。,,,,,,交易执行 结算,暂无解析,未设置,电力交易题库_结构化初版.docx,true
q_01419,12,第六章 市场合同,blank,"当系统运营商以签订合同的方式购买平衡资源时,应在合同中明确( )。",,,,,,执行费,暂无解析,未设置,电力交易题库_结构化初版.docx,true
q_01420,13,第六章 市场合同,blank,零售合同是指( )与( )针对电力零售交易事项签订的商务合同。,,,,,,售电公司 零售用户,暂无解析,未设置,电力交易题库_结构化初版.docx,true
q_01421,14,第六章 市场合同,blank,"根据《电力中长期交易基本规则》 (发改能源规〔2020〕 889号),全部合同约定交 易曲线的,按照( )形成次日发电计划。",,,,,,合同约定曲线,暂无解析,未设置,电力交易题库_结构化初版.docx,true
q_01422,15,第六章 市场合同,blank,合同常见的价格形式包括固定价格、 ( ),,,,,,浮动价格,暂无解析,未设置,电力交易题库_结构化初版.docx,true
q_01423,16,第六章 市场合同,blank,"期货交易所组织标准化合同的集中竞价交易和连续撮合交易,包括执行期为 ( )及以上的标准化差价合同、标准化远期合同、期货合同、期权合同等。",,,,,,一个月,暂无解析,未设置,电力交易题库_结构化初版.docx,true
q_01424,17,第六章 市场合同,blank,"按照交易方的数量划分,电力市场中的合同可以分为双边合同和( )。",,,,,,多边合同,暂无解析,未设置,电力交易题库_结构化初版.docx,true
q_01425,18,第六章 市场合同,blank,集中式现货交易采用全电量集中竟价、中长期差价合同等方式对冲( )风险。,,,,,,现货市场,暂无解析,未设置,电力交易题库_结构化初版.docx,true
q_01426,19,第六章 市场合同,blank,"规范购售电合同签订工作,要按照与地方电厂的( )及时签订购售电合同,杜 绝( )。",,,,,,结算关系 无合同购电,暂无解析,未设置,电力交易题库_结构化初版.docx,true
q_01427,20,第六章 市场合同,blank,"完成市场注册且已开展交易的电力用户,合同期满后未签订新的交易合同但发生实 际用电时,参加批发交易的用户按照各地规则进行( )结算,参加零售交易的用户按 照保底价格进行结算。",,,,,,偏差,暂无解析,未设置,电力交易题库_结构化初版.docx,true
q_01428,21,第六章 市场合同,blank,"根据《电力中长期交易基本规则》 (发改能源规〔2020〕 889号)'各市场成员应当 根据交易结果或者政府下达的计划电量,参照( )签订购售电合同。",,,,,,合同示范文本,暂无解析,未设置,电力交易题库_结构化初版.docx,true
q_01429,22,第六章 市场合同,blank,"申请退出跨区跨省市场的市场成员,应至少提前( )以书面形式告知电力交易 机构、电网企业等相关方,将所有已生效的( )合同、 ( )合同履行完毕或转让, 并处理好相关事宜。",,,,,,45天 购售电 交易,暂无解析,未设置,电力交易题库_结构化初版.docx,true
q_01430,23,第六章 市场合同,blank,各种金融性的长期合同、期货和期权合同等必须在( )市场中具体化。,,,,,,日前,暂无解析,未设置,电力交易题库_结构化初版.docx,true
q_01431,24,第六章 市场合同,blank,"根据《电力中长期交易基本规则》 (发改能源规〔2020〕 889号), ( )电量和 ( )电量的分月计划可由合同签订主体在( )前进行调整和确认",,,,,,优先发电 基数 月度执行,暂无解析,未设置,电力交易题库_结构化初版.docx,true
q_01432,25,第六章 市场合同,blank,合同的订立必须要经过( )、( )两个法定阶段,,,,,,要约 承诺,暂无解析,未设置,电力交易题库_结构化初版.docx,true
q_01433,26,第六章 市场合同,blank,金融合同的时间要素包括( ) ( ) ( )。,,,,,,交易日 到期日 交割日,暂无解析,未设置,电力交易题库_结构化初版.docx,true
q_01434,27,第六章 市场合同,blank,"在优先安排优先发电合同输电容量的前提下,鼓励( ) ( ) ( )利 用剩余输电容量直接进行跨区跨省交易。",,,,,,发电企业 售电公司 电力用户,暂无解析,未设置,电力交易题库_结构化初版.docx,true
q_01435,28,第六章 市场合同,blank,"电网企业(含关联企业)所属售电公司,不得通过电力交易机构、电力调度机构、 电网企业获得售电竞争方面的( )以及超过其他售电公司的优势权利。",,,,,,合同商务信息,暂无解析,未设置,电力交易题库_结构化初版.docx,true
q_01436,29,第六章 市场合同,blank,电子合同与纸质合同具备( )法律效力。,,,,,,同等,暂无解析,未设置,电力交易题库_结构化初版.docx,true
q_01437,30,第六章 市场合同,blank,"发电权交易、合同转让交易应当遵循购售双方的意愿,不得人为设置条件,原则上 鼓励清洁、高效机组替代( )发电。",,,,,,低效机组,暂无解析,未设置,电力交易题库_结构化初版.docx,true
q_01438,31,第六章 市场合同,blank,"远期合约和期权在投资风险、交易方式、用途、合约类型、交易方式等方面均有所不 同'其中在合约类型方面, ( )不是标准化的合同, ( )是一种高度标准化的合约。",,,,,,远期合约 期权,暂无解析,未设置,电力交易题库_结构化初版.docx,true
q_01439,32,第六章 市场合同,blank,"( )合约是指交易双方约定在未来的某一确定时间内,按照事先商定的价格, 以预先确定的方式买卖一定数量的某种标的物的合约。",,,,,,远期,暂无解析,未设置,电力交易题库_结构化初版.docx,true
q_01440,33,第六章 市场合同,blank,"以双边协商和滚动撮合形式开展的电力中长期交易鼓励( ),以集中竞价交易 形式开展的电力中长期交易应当实现( )。双边合同在双边交易申报截止时间前均可提 交或者修改。",,,,,,连续开市 定期开市,暂无解析,未设置,电力交易题库_结构化初版.docx,true
q_01441,34,第六章 市场合同,blank,"允许发用双方在协商一致的前提下,可在合同执行( )前进行动态调整。鼓励 市场主体通过( )交易实现月度发用电计划调整,减少合同执行偏差。",,,,,,一周 月内(多日),暂无解析,未设置,电力交易题库_结构化初版.docx,true
q_01442,35,第六章 市场合同,blank,"购售电合同原则上应当采用电子合同签订,电力交易平台应当满足国家电子合同有 关规定的技术要求'市场成员应当依法使用可靠的( ),电子合同与纸质合同具备同等 效力。",,,,,,电子签名,暂无解析,未设置,电力交易题库_结构化初版.docx,true
q_01443,36,第六章 市场合同,blank,"根据《电力中长期交易基本规则》 (发改能源规〔2020〕 889号),年度合同的执行 周期内, ( )前,在购售双方一致同意且不影响其他市场主体交易合同执行的基础上, 允许通过电力交易平台调整后续各月的( ),保持( )不变,调整后的分月计划需 通过电力调度机构安全校核。",,,,,,次月交易开始 合同分月计划 合同总量,暂无解析,未设置,电力交易题库_结构化初版.docx,true
q_01444,37,第六章 市场合同,blank,"在分散式市场模式下,电力交易以签订( )为基础,发用双方在日前阶段自行 确定曰发用电曲线。",,,,,,实物合同,暂无解析,未设置,电力交易题库_结构化初版.docx,true
q_01445,38,第六章 市场合同,blank,"( )是双方当事人在合同中订立的,事先通过约定来限制或者免除其未来关于 此合同相关责任的条款。",,,,,,免责条款,暂无解析,未设置,电力交易题库_结构化初版.docx,true
q_01446,39,第六章 市场合同,blank,中长期交易可以是( )合同、( )合同等一种或多种形式签订,,,,,,实物 差价,暂无解析,未设置,电力交易题库_结构化初版.docx,true
q_01447,40,第六章 市场合同,blank,"在集中式市场中,中长期合约是金融性质的差价合约,分解曲线和合约价格仅作为 结算依据,无中长期偏差电量考核,对合同偏差电量采取( )偏差结算方式",,,,,,现货市场,暂无解析,未设置,电力交易题库_结构化初版.docx,true
q_01448,41,第六章 市场合同,blank,"如果差价合同的履约价格( )集中市场价格,购买方需要向卖出方支付一定金 额,它等于这两种价格的差价乘以合同规定的交易数量。",,,,,,高于,暂无解析,未设置,电力交易题库_结构化初版.docx,true
q_01449,42,第六章 市场合同,blank,"在跨区跨省交易中,合同变更交易电量、电力时'仅可进行( )",,,,,,调减,暂无解析,未设置,电力交易题库_结构化初版.docx,true
q_01450,43,第六章 市场合同,blank,"《国家发展改革委国家能源局关于做好2024年电力中长期合同签订履约工作的通 知》 (发改运行〔2023〕 1662号)中指出,各地政府主管部门要积极引导各类经营主体签订 多年期电力中长期合同,推进( )、( )、( )等签订多年期电力中长期合同。 ゜竹根据《关于有序放开发用电计划的实施意见》, ( )合同原则上至少为期一年, 双方必须约定违约责任,否则合同不得中途中止。",,,,,,直接交易,暂无解析,未设置,电力交易题库_结构化初版.docx,true
q_01451,45,第六章 市场合同,blank,"根据《关于全面放开经营性电力用户发用电计划的通知》 (发改运行〔2019〕 ¨05 号),积极支持中小用户由售电公司代理参加市场化交易,中小用户需与售电公司签订 ( ),与电网企业签订( ),明确有关权责义务。",,,,,,代理购电合同 供用电合同,暂无解析,未设置,电力交易题库_结构化初版.docx,true
q_01452,46,第六章 市场合同,blank,"《国家发展改革委国家能源局关于做好2024年电力中长期合同签订履约工作的通 知》 (发改运行〔2023〕 1662号)中指出,在落实现行煤电上网电价机制基础上,鼓励各地 政府主管部门指导相关经营主体在电力中长期合同中设立( )与( )价格挂钩的 联动条款。",,,,,,交易电价 上下游商品,暂无解析,未设置,电力交易题库_结构化初版.docx,true
q_01453,47,第六章 市场合同,blank,"根据《国家发展改革委国家能源局关于加快建设全国统一电力市场体系的指导意 见》 (发改体改〔2022〕 118号),要培育多元竟争的市场主体,有序放开发用电计划,推动 将( )、 ( )计划转化为政府授权的中长期合同。",,,,,,优先发电 优先购电,暂无解析,未设置,电力交易题库_结构化初版.docx,true
q_01454,48,第六章 市场合同,blank,"根据《国家发展改革委办公厅关于组织开展电网企业代理购电工作有关事项的通 知》 (发改办价格〔2021〕 809号),在现货市场未运行的地方,电网企业代理购电用户 ( )未申报用电曲线,以及申报用电曲线但分时电价峰谷比例( )当地分时电价政 策要求的,用户用电价格应当按照当地分时电价政策规定的时段划分及浮动比例执行。",,,,,,代理购电合同 低于,暂无解析,未设置,电力交易题库_结构化初版.docx,true
q_01455,49,第六章 市场合同,blank,"跨区跨省交易中,售方的交易合同转让原则上应保持购方落地省的( )不变, 购方的交易合同转让原则上应保持售方的( )不变。",,,,,,落地价格 上网价格,暂无解析,未设置,电力交易题库_结构化初版.docx,true
q_01456,50,第六章 市场合同,blank,"对冲是指拥有实物仓位的市场参与者,在市场上买卖( ),用来提高其实体业 务的盈利能力。",,,,,,金融合同,暂无解析,未设置,电力交易题库_结构化初版.docx,true
q_01457,51,第六章 市场合同,blank,金融输电权是一种在日前市场中让市场主体抵消( )的合同。,,,,,,输电阻塞成本,暂无解析,未设置,电力交易题库_结构化初版.docx,true
q_01458,52,第六章 市场合同,blank,"金融输电权是为市场交易者规避价格波动风险而设立的金融工具,它通过( ) 合同实现,这个合同的支付取决于电力现货市场的成交结果。",,,,,,金融支付,暂无解析,未设置,电力交易题库_结构化初版.docx,true
q_01459,53,第六章 市场合同,blank,"根据《中共中央国务院关于进一步深化电力体制改革的若干意见》 (中发〔2015〕 9号),鼓励( )与( )之间签订长期稳定的合同,建立并完善实现合同调整及偏 差电量处理的交易平衡机制。",,,,,,用户 发电企业,暂无解析,未设置,电力交易题库_结构化初版.docx,true
q_01460,54,第六章 市场合同,blank,"根据《中共中央国务院关于进一步深化电力体制改革的若干意见》 (中发〔2015〕 9 号),鼓励售电主体创新服务,向用户提供包括( )、综合节能和用能咨询等增值服务",,,,,,合同能源管理,暂无解析,未设置,电力交易题库_结构化初版.docx,true
q_01461,55,第六章 市场合同,blank,"《国家发展改革委国家能源局关于做好2024年电力中长期合同签订履约工作的通 知》 (发改运行(2023〕 1662号)中提出探索畅通批发、零售市场价格传导机制,按照国家 相关价格政策要求,逐步推动批发市场形成的( )信号通过( )方式向零售用户 合理传导。",,,,,,分时价格 市场化,暂无解析,未设置,电力交易题库_结构化初版.docx,true
q_01462,56,第六章 市场合同,blank,"按照《国家发展改革委国家能源局关于做好2023年电力中长期合同签订履约工作 的通知》 (发改运行〔2022〕 1861号),在市场主体已授权的前提下,可通过交易平台自动 履行电子签约手续,并形成规范的( )。",,,,,,电子合同制式文本,暂无解析,未设置,电力交易题库_结构化初版.docx,true
q_01463,57,第六章 市场合同,blank,"根据《国家发展改革委国家能源局关于做好2024年电力中长期合同签订履约工作 的通知》 (发改运行〔2023〕 1662号),各地政府主管部门要建立健全市场交易信用监管机 制,根据市场信用状况开展分级履约监管,对连续( )个月无法按时履约的经营主体 进行约谈。",,,,,,3,暂无解析,未设置,电力交易题库_结构化初版.docx,true
q_01464,58,第六章 市场合同,blank,"跨区跨省交易中,采用灵活浮动价格机制的交易(原交易开展时应填报初始价 格),每月( )前,填报要约的经营主体应在交易平台填报上月浮动后的( )价 格,若未填报,则按初始价格出具结算依据。",,,,,,第3个工作日 变更,暂无解析,未设置,电力交易题库_结构化初版.docx,true
q_01465,59,第六章 市场合同,blank,计划合同电量指依据政府或其授权部门下达的计划'在购售电双方签订的合同中约 定的( )电量。,,,,,,非竞争,暂无解析,未设置,电力交易题库_结构化初版.docx,true
q_01466,60,第六章 市场合同,blank,"根据《国家电网有限公司关于加快建设全国统一电力市场体系的实施意见》 (国家 电网体改〔2022〕 717号),省间交易优先落实电网安全保供支撑电源电量,持续完善签订 政府授权的( )合同,落实国家送电计划、政府间送电协议",,,,,,带曲线中长期,暂无解析,未设置,电力交易题库_结构化初版.docx,true
